{
  "id": "prof_cert_req_ecom_001",
  "version": "1.0.0",
  "schema_version": "profile-1.0",
  "profile_type": "CertificationRequirementProfile",
  "scope": "internal",
  "owner": "enterprise_cert_node_001",
  "approved_by": "knowledge_governance_owner",
  "approval_status": "approved",
  "effective_from": "2026-01-01",
  "effective_until": "2027-12-31",
  "supersedes": [],
  "change_reason": "initial ecommerce certification requirement",
  "status": "active",
  "domain": {
    "logic": "ALL_OF",
    "n": 1,
    "requirements": [
      {
        "issuer": "enterprise_cert_node_001",
        "scope": "enterprise_private",
        "trust_domain": "example.enterprise.internal",
        "not_revoked": true
      },
      {
        "issuer": "external_ca",
        "scope": "external",
        "trust_domain": "external.ca.org",
        "not_revoked": true
      }
    ]
  },
  "digest": "9ed012b89e21a2104caf55511b5f83f7fc66b7ed8400b4eee77de79d87c0df33"
}
